Command:
tcpdump icmp

Result:
listening on eth0, link-type EN10MB (Ethernet), capture size 262144 bytes
13:12:15.123456 IP 192.168.1.100 > 8.8.8.8: ICMP echo request, id 1234, seq 1, length 64
13:12:15.234567 IP 8.8.8.8 > 192.168.1.100: ICMP echo reply, id 1234, seq 1, length 64
...

Command:
tcpdump -i eth0 port 80

Result:
listening on eth0, link-type EN10MB (Ethernet), capture size 262144 bytes
13:15:20.345678 IP 192.168.1.101.34567 > 203.0.113.1.80: Flags [S], seq 1234, win 65535, options [mss 1460,sackOK,eol], length 0
13:15:20.456789 IP 203.0.113.1.80 > 192.168.1.101.34567: Flags [S.], seq 5678, ack 1235, win 65535, options [mss 1460,sackOK,eol], length 0
...

Command:
tcpdump udp port 53

Result:
listening on eth0, link-type EN10MB (Ethernet), capture size 262144 bytes
13:20:25.567890 IP 192.168.1.102.12345 > 8.8.4.4.53: 12345+ A? example.com. (28)
13:20:25.678901 IP 8.8.4.4.53 > 192.168.1.102.12345: 12345* 1/0/0 A 192.0.2.1 (44)
...

Command:
tcpdump src host 192.168.1.103

Result:
listening on eth0, link-type EN10MB (Ethernet), capture size 262144 bytes
13:25:30.789012 IP 192.168.1.103.54321 > 203.0.113.1.80: Flags [S], seq 1234, win 65535, options [mss 1460,sackOK,eol], length 0
13:25:30.890123 IP 203.0.113.1.80 > 192.168.1.103.54321: Flags [S.], seq 5678, ack 1235, win 65535, options [mss 1460,sackOK,eol], length 0
...

Command:
tcpdump dst host 203.0.113.1

Result:
listening on eth0, link-type EN10MB (Ethernet), capture size 262144 bytes
13:30:35.901234 IP 192.168.1.104.54321 > 203.0.113.1.80: Flags [S], seq 1234, win 65535, options [mss 1460,sackOK,eol], length 0
13:30:36.012345 IP 203.0.113.1.80 > 192.168.1.104.54321: Flags [S.], seq 5678, ack 1235, win 65535, options [mss 1460,sackOK,eol], length 0
...
